clientTag,clientName,solutionTag,solutionName,programTag,programName,outreachTag,outreachName,channel
eric,   eric,   sol1, Solution 1, prog1, Program 1, out1, Outreach1, IVR
jason,  jason,  sol1, Solution 1, prog1, Program 1, out1, Outreach1, IVR
judy,   judy,   sol1, Solution 1, prog1, Program 1, out1, Outreach1, IVR
monika, monika, sol1, Solution 1, prog1, Program 1, out1, Outreach1, IVR
phoebe, phoebe, sol1, Solution 1, prog1, Program 1, out1, Outreach1, IVR
moose,  moose,  sol1, Solution 1, prog1, Program 1, out1, Outreach1, IVR
maggie, maggie, sol1, Solution 1, prog1, Program 1, out1, Outreach1, IVR
antonio,antonio,sol1, Solution 1, prog1, Program 1, out1, Outreach1, IVR
fish,   fish,   sol1, Solution 1, prog1, Program 1, out1, Outreach1, IVR